{
  "branch": "research/level2-energy-regime",
  "campaign_id": "level3-s7-truncation-extension-v1",
  "campaign_status": "COMPLETE",
  "frozen_preregistration_commit": "cc0ffdadbeb7d40fc443ab11150c9f47e3e12776",
  "geometries": [
    {
      "a_qq": {
        "delta_hl_s2": {
          "reason": null,
          "value": 0.0
        },
        "delta_hl_s3": {
          "reason": null,
          "value": 0.03472222222222243
        },
        "delta_hl_s4": {
          "reason": null,
          "value": -0.026223776223776363
        },
        "delta_hl_s5": {
          "reason": null,
          "value": -0.021067415730337324
        },
        "delta_hl_s6": {
          "reason": null,
          "value": 0.017605633802816878
        },
        "delta_hl_s7": {
          "reason": null,
          "value": -0.015120967741935165
        },
        "metric": "A_QQ"
      },
      "geometry": "ring4",
      "m_qq": {
        "delta_hl_s2": {
          "reason": null,
          "value": 0.034741636495151496
        },
        "delta_hl_s3": {
          "reason": null,
          "value": 0.023097563037031532
        },
        "delta_hl_s4": {
          "reason": null,
          "value": 0.05155770008652544
        },
        "delta_hl_s5": {
          "reason": null,
          "value": 0.06041461015956956
        },
        "delta_hl_s6": {
          "reason": null,
          "value": 0.06474281975406132
        },
        "delta_hl_s7": {
          "reason": null,
          "value": 0.07003146920280401
        },
        "metric": "M_QQ"
      },
      "m_tt": {
        "c_x_56": {
          "reason": null,
          "value": 0.10493909311946484
        },
        "c_x_67": {
          "reason": null,
          "value": 0.1389869740943195
        },
        "d_x_56": {
          "reason": null,
          "value": 1.3380906050716723
        },
        "d_x_67": {
          "reason": null,
          "value": 1.3123722712921992
        },
        "delta_hl_s2": {
          "reason": null,
          "value": -0.007742838926974305
        },
        "delta_hl_s3": {
          "reason": null,
          "value": -0.005857982377896448
        },
        "delta_hl_s4": {
          "reason": null,
          "value": 0.02040937556731595
        },
        "delta_hl_s5": {
          "reason": null,
          "value": 0.024002328924935146
        },
        "delta_hl_s6": {
          "reason": null,
          "value": 0.017141998370443307
        },
        "delta_hl_s7": {
          "reason": null,
          "value": 0.030544128373147184
        },
        "direction_s2": "NEGATIVE",
        "direction_s3": "NEGATIVE",
        "direction_s4": "POSITIVE",
        "direction_s5": "POSITIVE",
        "direction_s6": "POSITIVE",
        "direction_s7": "POSITIVE",
        "last_two_transitions_directionally_continuous_567": "YES",
        "metric": "M_TT",
        "pairwise_block_recurrence_23_45_67": "NO",
        "primary_s6_s7_taxonomy": "S7_DIRECTION_PERSISTS",
        "r_d_x_67_56": {
          "reason": null,
          "value": 0.9807798263570534
        },
        "r_delta_x_67_56": {
          "reason": null,
          "value": 1.9535691314362045
        },
        "reversal_count_234567": 1,
        "t_x_56": {
          "reason": null,
          "value": 0.006860330554491839
        },
        "t_x_67": {
          "reason": null,
          "value": 0.013402130002703877
        }
      },
      "r_eff": {
        "c_x_56": {
          "reason": null,
          "value": 0.022945005484438515
        },
        "c_x_67": {
          "reason": null,
          "value": -0.02155363963446354
        },
        "d_x_56": {
          "reason": null,
          "value": 1.3979980302842638
        },
        "d_x_67": {
          "reason": null,
          "value": 1.4294424405085524
        },
        "delta_hl_s2": {
          "reason": null,
          "value": -0.0020882959675153634
        },
        "delta_hl_s3": {
          "reason": null,
          "value": -0.0021358495740230188
        },
        "delta_hl_s4": {
          "reason": null,
          "value": -0.01456570479028163
        },
        "delta_hl_s5": {
          "reason": null,
          "value": -0.01809462533402406
        },
        "delta_hl_s6": {
          "reason": null,
          "value": -0.025303329519379525
        },
        "delta_hl_s7": {
          "reason": null,
          "value": -0.026171719818302353
        },
        "direction_s2": "NEGATIVE",
        "direction_s3": "NEGATIVE",
        "direction_s4": "NEGATIVE",
        "direction_s5": "NEGATIVE",
        "direction_s6": "NEGATIVE",
        "direction_s7": "NEGATIVE",
        "last_two_transitions_directionally_continuous_567": "YES",
        "metric": "R_eff",
        "pairwise_block_recurrence_23_45_67": "NO",
        "primary_s6_s7_taxonomy": "S7_DIRECTION_PERSISTS",
        "r_d_x_67_56": {
          "reason": null,
          "value": 1.0224924567439446
        },
        "r_delta_x_67_56": {
          "reason": null,
          "value": 0.12046413288631944
        },
        "reversal_count_234567": 0,
        "t_x_56": {
          "reason": null,
          "value": 0.007208704185355463
        },
        "t_x_67": {
          "reason": null,
          "value": 0.0008683902989228276
        }
      }
    },
    {
      "a_qq": {
        "delta_hl_s2": {
          "reason": null,
          "value": 0.015999999999999903
        },
        "delta_hl_s3": {
          "reason": null,
          "value": 0.01196808510638303
        },
        "delta_hl_s4": {
          "reason": null,
          "value": -0.008964143426294813
        },
        "delta_hl_s5": {
          "reason": null,
          "value": -0.0071656050955414274
        },
        "delta_hl_s6": {
          "reason": null,
          "value": 0.005968169761273123
        },
        "delta_hl_s7": {
          "reason": null,
          "value": -0.005113636363636376
        },
        "metric": "A_QQ"
      },
      "geometry": "ring5",
      "m_qq": {
        "delta_hl_s2": {
          "reason": null,
          "value": 0.020202352134593093
        },
        "delta_hl_s3": {
          "reason": null,
          "value": 0.046124103926328375
        },
        "delta_hl_s4": {
          "reason": null,
          "value": 0.07162742518780663
        },
        "delta_hl_s5": {
          "reason": null,
          "value": 0.08253733329086804
        },
        "delta_hl_s6": {
          "reason": null,
          "value": 0.08106298805310302
        },
        "delta_hl_s7": {
          "reason": null,
          "value": 0.09016970008400693
        },
        "metric": "M_QQ"
      },
      "m_tt": {
        "c_x_56": {
          "reason": null,
          "value": 0.11210148134601557
        },
        "c_x_67": {
          "reason": null,
          "value": 0.09846649326771163
        },
        "d_x_56": {
          "reason": null,
          "value": 1.3328860830052787
        },
        "d_x_67": {
          "reason": null,
          "value": 1.342968744399145
        },
        "delta_hl_s2": {
          "reason": null,
          "value": -0.005818691260019174
        },
        "delta_hl_s3": {
          "reason": null,
          "value": 0.004351133007983621
        },
        "delta_hl_s4": {
          "reason": null,
          "value": 0.015489274489672966
        },
        "delta_hl_s5": {
          "reason": null,
          "value": 0.0199306997477227
        },
        "delta_hl_s6": {
          "reason": null,
          "value": 0.01711523186576633
        },
        "delta_hl_s7": {
          "reason": null,
          "value": 0.021019110974617283
        },
        "direction_s2": "NEGATIVE",
        "direction_s3": "POSITIVE",
        "direction_s4": "POSITIVE",
        "direction_s5": "POSITIVE",
        "direction_s6": "POSITIVE",
        "direction_s7": "POSITIVE",
        "last_two_transitions_directionally_continuous_567": "YES",
        "metric": "M_TT",
        "pairwise_block_recurrence_23_45_67": "NO",
        "primary_s6_s7_taxonomy": "S7_DIRECTION_PERSISTS",
        "r_d_x_67_56": {
          "reason": null,
          "value": 1.0075645334754586
        },
        "r_delta_x_67_56": {
          "reason": null,
          "value": 1.3865827182295132
        },
        "reversal_count_234567": 1,
        "t_x_56": {
          "reason": null,
          "value": 0.002815467881956371
        },
        "t_x_67": {
          "reason": null,
          "value": 0.003903879108850955
        }
      },
      "r_eff": {
        "c_x_56": {
          "reason": null,
          "value": 0.049725787646787874
        },
        "c_x_67": {
          "reason": null,
          "value": 0.08447306385952612
        },
        "d_x_56": {
          "reason": null,
          "value": 1.3790190130754818
        },
        "d_x_67": {
          "reason": null,
          "value": 1.3534686912280225
        },
        "delta_hl_s2": {
          "reason": null,
          "value": 0.002277479585917397
        },
        "delta_hl_s3": {
          "reason": null,
          "value": -0.009134320925960226
        },
        "delta_hl_s4": {
          "reason": null,
          "value": -0.018150290740480468
        },
        "delta_hl_s5": {
          "reason": null,
          "value": -0.022833426281724134
        },
        "delta_hl_s6": {
          "reason": null,
          "value": -0.02196454701016648
        },
        "delta_hl_s7": {
          "reason": null,
          "value": -0.02332285392884359
        },
        "direction_s2": "POSITIVE",
        "direction_s3": "NEGATIVE",
        "direction_s4": "NEGATIVE",
        "direction_s5": "NEGATIVE",
        "direction_s6": "NEGATIVE",
        "direction_s7": "NEGATIVE",
        "last_two_transitions_directionally_continuous_567": "YES",
        "metric": "R_eff",
        "pairwise_block_recurrence_23_45_67": "NO",
        "primary_s6_s7_taxonomy": "S7_DIRECTION_PERSISTS",